<?xml version="1.0" encoding="UTF-8"?>
<SoftwareCitationRoot xmlns:xsi="http://www.w3.org/2001/XMLSchema-instance"
    xsi:noNamespaceSchemaLocation="combined_simple_v3.xsd">
    <SoftwareCitationList>
        <SoftwareCitation>
            <PublicationIdentifier>
                <IdentifierType>DOI</IdentifierType>
                <IdentifierValue>10.1145/2756406.2756929</IdentifierValue>
            </PublicationIdentifier>
            <SoftwareUsage>
                <IdentifierType>URL</IdentifierType>
                <IdentifierValue>https://www.inphoproject.org</IdentifierValue>
                <Objective>
                    <UsageFeature>Visualization</UsageFeature>
                    <Description>Print Screen of the Website, Tools description</Description>
                    <Page>1</Page>
                </Objective>
            </SoftwareUsage>
        </SoftwareCitation>
        <SoftwareCitation>
            <PublicationIdentifier>
                <IdentifierType>DOI</IdentifierType>
                <IdentifierValue>10.1007/s11229-009-9659-9</IdentifierValue>
            </PublicationIdentifier>
            <SoftwareUsage>
                <IdentifierType>URL</IdentifierType>
                <IdentifierValue>https://www.inphoproject.org</IdentifierValue>
                <Objective>
                    <UsageFeature>Figure</UsageFeature>
                    <Description>View of InPhO interface showing crosslinks (@) from philosophy of cognitive science to other topics. SEP thinker icons to the left of terms indicate links to Stanford Encyclopedia articles, while the ‘SEP’, ‘Noesis’, ‘Scholar’ links provide direct access to the search engines using a query that is composed of that term plus its superordinate category</Description>
                    <Page>1</Page>
                </Objective>
            </SoftwareUsage>
        </SoftwareCitation>
    </SoftwareCitationList>
    <PublicationList>
        <Publication>
            <PublicationTitle>Topic Exploration with the HTRC Data Capsule for Non-Consumptive Research</PublicationTitle>
            <PublicationIdentifiers>
                <PublicationIdentifier>
                    <IdentifierType>DOI</IdentifierType>
                    <IdentifierValue>10.1145/2756406.2756929</IdentifierValue>
                </PublicationIdentifier>
            </PublicationIdentifiers>
            <Authors>
                <Author>
                    <Identifier>
                        <IdentifierType>local</IdentifierType>
                        <IdentifierValue>1</IdentifierValue>
                    </Identifier>                    
                </Author>     
                <Author>
                    <Identifier>
                        <IdentifierType>local</IdentifierType>
                        <IdentifierValue>2</IdentifierValue>
                    </Identifier>                    
                </Author>    
            </Authors>
        </Publication>
        <Publication>
            <PublicationTitle>From encyclopedia to ontology: toward dynamic representation of the discipline of philosophy</PublicationTitle>
            <PublicationIdentifiers>
                <PublicationIdentifier>
                    <IdentifierType>DOI</IdentifierType>
                    <IdentifierValue>10.1007/s11229-009-9659-9</IdentifierValue>
                </PublicationIdentifier>
            </PublicationIdentifiers>
            <Authors>
                <Author>
                    <Identifier>
                        <IdentifierType>local</IdentifierType>
                        <IdentifierValue>3</IdentifierValue>
                    </Identifier>                    
                </Author>     
                <Author>
                    <Identifier>
                        <IdentifierType>local</IdentifierType>
                        <IdentifierValue>4</IdentifierValue>
                    </Identifier>                    
                </Author>
                <Author>
                    <Identifier>
                        <IdentifierType>local</IdentifierType>
                        <IdentifierValue>5</IdentifierValue>
                    </Identifier>                    
                </Author>    
            </Authors>
        </Publication>
    </PublicationList>
    <AuthorList>
        <Author>
            <AuthorIdentifiers>
                <AuthorIdentifier>
                    <Identifier>
                        <IdentifierType>local</IdentifierType>
                        <IdentifierValue>1</IdentifierValue>
                        <RecordedDate>2019-10-27T14:39:00</RecordedDate>
                    </Identifier>
                </AuthorIdentifier>
            </AuthorIdentifiers>
            <AuthorNames>
                <AuthorName>
                    <FirstName>Jaimie</FirstName>
                    <LastName>Murdock</LastName>
                    <RecordedDate>2019-10-27T14:39:00</RecordedDate>
                </AuthorName>
            </AuthorNames>     
        </Author>
        <Author>
            <AuthorIdentifiers>
                <AuthorIdentifier>
                    <Identifier>
                        <IdentifierType>local</IdentifierType>
                        <IdentifierValue>2</IdentifierValue>
                        <RecordedDate>2019-10-27T14:39:00</RecordedDate>
                    </Identifier>
                </AuthorIdentifier>
            </AuthorIdentifiers>
            <AuthorNames>
                <AuthorName>
                    <FirstName>Jiaan</FirstName>
                    <LastName>Zeng</LastName>
                    <RecordedDate>2019-10-27T14:39:00</RecordedDate>
                </AuthorName>
            </AuthorNames>
        </Author>
        <Author>
            <AuthorIdentifiers>
                <AuthorIdentifier>
                    <Identifier>
                        <IdentifierType>local</IdentifierType>
                        <IdentifierValue>3</IdentifierValue>
                        <RecordedDate>2019-10-27T14:39:00</RecordedDate>
                    </Identifier>
                </AuthorIdentifier>
            </AuthorIdentifiers>
            <AuthorNames>
                <AuthorName>
                    <FirstName>Cameron</FirstName>
                    <LastName>Buckner</LastName>
                    <RecordedDate>2019-10-27T14:39:00</RecordedDate>
                </AuthorName>
            </AuthorNames>
        </Author>
        <Author>
            <AuthorIdentifiers>
                <AuthorIdentifier>
                    <Identifier>
                        <IdentifierType>local</IdentifierType>
                        <IdentifierValue>4</IdentifierValue>
                        <RecordedDate>2019-10-27T14:39:00</RecordedDate>
                    </Identifier>
                </AuthorIdentifier>
            </AuthorIdentifiers>
            <AuthorNames>
                <AuthorName>
                    <FirstName>Mathias</FirstName>
                    <LastName>Niepert</LastName>
                    <RecordedDate>2019-10-27T14:39:00</RecordedDate>
                </AuthorName>
            </AuthorNames>
        </Author>
        <Author>
            <AuthorIdentifiers>
                <AuthorIdentifier>
                    <Identifier>
                        <IdentifierType>local</IdentifierType>
                        <IdentifierValue>5</IdentifierValue>
                        <RecordedDate>2019-10-27T14:39:00</RecordedDate>
                    </Identifier>
                </AuthorIdentifier>
            </AuthorIdentifiers>
            <AuthorNames>
                <AuthorName>
                    <FirstName>Colin</FirstName>
                    <LastName>Allen</LastName>
                    <RecordedDate>2019-10-27T14:39:00</RecordedDate>
                </AuthorName>
            </AuthorNames>
        </Author>
    </AuthorList>
    <SoftwareList>
        <Software>
            <SoftwareNames>
                <SoftwareName>The InPhO Project</SoftwareName>
            </SoftwareNames>
            <SoftwareIdentifier>
                <IdentifierType>URL</IdentifierType>
                <IdentifierValue>https://www.inphoproject.org</IdentifierValue>
            </SoftwareIdentifier>
            <SoftwarePlatforms>
                <PlatformName>Python</PlatformName>
                <PlatformName>Javascript</PlatformName>
                <PlatformName>Jupyter Notebook</PlatformName>
            </SoftwarePlatforms>
            <Repository>
                <RepoType>Github</RepoType>
                <URL>https://github.com/inpho/</URL>
            </Repository>
            <Version></Version>
            <Features>
                <Feature>
                    <FeatureName>Topic Modeling</FeatureName>
                    <Description></Description>
                </Feature>
                <Feature>
                    <FeatureName>Data Mining</FeatureName>
                    <Description></Description>
                </Feature>
                <Feature>
                    <FeatureName>Searching</FeatureName>
                    <Description></Description>
                </Feature>
            </Features>
            <Contributors>
                <Contributor>
                    <Identifier>
                        <IdentifierType>local</IdentifierType>
                        <IdentifierValue>1</IdentifierValue>
                    </Identifier>             
                </Contributor>
            </Contributors>
        </Software>
    </SoftwareList>
</SoftwareCitationRoot>